{
  "schema_version": "robotcad.operation_plan_pilot.v1",
  "case_id": "dev_arm-dcc2b0ce1e",
  "link_id": "L3",
  "mechanical_intent": {
    "role": "elbow housing link between shoulder joint J2 and forearm joint J3",
    "geometry_intent": "tapered arm web connecting a large proximal joint housing (J2 side) to a compact cylindrical elbow housing (J3 side, 35 mm axial offset along +Z, roll axis -X), with a large lightening cutout in the web",
    "surface_features": [
      "proximal bearing boss",
      "tapered web with lightening cutout",
      "elbow cylindrical housing",
      "bolt flange on elbow face",
      "filleted web-to-housing transitions"
    ]
  },
  "interface_constraints": [
    {
      "joint_id": "J2",
      "type": "revolute",
      "axis": "0 1 0",
      "origin_xyz": "0.560 0 0",
      "constraint": "proximal housing bore coaxial with Y at origin (0.560, 0, 0); bearing seat and bolt flange concentric to this axis",
      "parent_link": "L2",
      "child_link": "L3"
    },
    {
      "joint_id": "J3",
      "type": "revolute",
      "axis": "-1 0 0",
      "origin_xyz": "0 0 0.035",
      "constraint": "distal elbow bore coaxial with -X at (0, 0, 0.035); output flange face perpendicular to X, centered 35 mm above link datum",
      "parent_link": "L3",
      "child_link": "L4"
    }
  ],
  "operations": [
    {
      "op": "CreateSketchProfile",
      "purpose": "base housing",
      "detail": "Sketch proximal joint housing outline on YZ plane centered at J2 origin (0.560, 0, 0); rounded housing silhouette with mounting lug tabs.",
      "operation_id": "OP1"
    },
    {
      "op": "Extrude",
      "purpose": "base housing",
      "detail": "Extrude proximal housing profile symmetric about X to full housing width; this forms the J2-side bearing carrier.",
      "operation_id": "OP2"
    },
    {
      "op": "CreateSketchProfile",
      "purpose": "taper",
      "detail": "Sketch tapered arm web on XY plane: wide at proximal housing, narrowing toward elbow end, with smooth concave side edges.",
      "operation_id": "OP3"
    },
    {
      "op": "Extrude",
      "purpose": "web",
      "detail": "Extrude web profile with draft/taper to blend housing widths between J2 housing and elbow housing envelope.",
      "operation_id": "OP4"
    },
    {
      "op": "BooleanUnion",
      "purpose": "merge",
      "detail": "Union web with proximal housing into single solid.",
      "operation_id": "OP5"
    },
    {
      "op": "CreateHole",
      "purpose": "lightening cutout",
      "detail": "Cut large oval through-hole in web mid-span, centered between housings, to reduce mass as seen in front/rear views.",
      "operation_id": "OP6"
    },
    {
      "op": "Revolve",
      "purpose": "elbow housing",
      "detail": "Revolve cylindrical elbow housing profile 360 deg about -X axis at (0, 0, 0.035), forming compact drum with 35 mm axial offset from link datum.",
      "operation_id": "OP7"
    },
    {
      "op": "BooleanUnion",
      "purpose": "merge",
      "detail": "Union elbow drum with tapered web distal end.",
      "operation_id": "OP8"
    },
    {
      "op": "CreateSketchProfile",
      "purpose": "flange",
      "detail": "Sketch circular flange face on elbow housing at X-min end, coaxial with J3 axis.",
      "operation_id": "OP9"
    },
    {
      "op": "Extrude",
      "purpose": "flange",
      "detail": "Extrude flange ring outward; add bolt pattern via CreateHole + CircularPattern (evenly spaced fastener holes on flange bolt circle).",
      "operation_id": "OP10"
    },
    {
      "op": "CreateHole",
      "purpose": "bearing seat",
      "detail": "Cut precision bore through elbow drum coaxial with J3 (-X) axis for bearing/cross-bearing seat; counterbore both faces.",
      "operation_id": "OP11"
    },
    {
      "op": "CreateHole",
      "purpose": "bearing seat",
      "detail": "Cut J2 bore through proximal housing coaxial with Y axis, with bearing shoulder seats on both sides.",
      "operation_id": "OP12"
    },
    {
      "op": "Shell",
      "purpose": "lightening",
      "detail": "Optionally hollow proximal housing interior with wall thickness offset, retaining bearing boss solids.",
      "operation_id": "OP13"
    },
    {
      "op": "ApplyFillet",
      "purpose": "rounded transition",
      "detail": "Fillet all web-to-housing junctions and outer web edges with generous radius to match smooth blended appearance.",
      "operation_id": "OP14"
    },
    {
      "op": "ApplyChamfer",
      "purpose": "edge break",
      "detail": "Chamfer flange outer edge and bore lips for assembly lead-in.",
      "operation_id": "OP15"
    }
  ],
  "prohibited_input_ack": "No GT mesh, original CAD, product identity, or hidden labels were used."
}